{
  "schema_version": "1",
  "artifact_type": "heartbeat",
  "pane": "surface:75",
  "branch": "feature/issue-31",
  "head_sha": "e86c685a1b2c3d4e5f60718293a4b5c6d7e8f901",
  "task": "implement Task B1 phase_summary + heartbeat schemas",
  "blocked": false,
  "dirty": true,
  "updated_at": "2026-05-23T14:32:00Z",
  "last_verify_at": "2026-05-23T14:28:00Z",
  "last_verify_artifact": ".review/ISSUE-31-VERIFY.json"
}
